Key,Polish
Dialogue.Bartender_01_WatllItBe,Co podać?
Dialogue.Bartender_02_AhYes,"Ah, tak. Musisz by agentem DOWÓDZTWA. Hacker jest w barze po drugiej stronie. Musisz jakoś przedostać się niepostrzeżona na drugą stronę granicy."
Dialogue.Bartender_03_ThankYou,"Dziękuje Ci, agencie. Hacker powiedział mi, że ukrył dokumenty w kuchni po drugiej stronie, które powinnaś zabrać ze sobą zanim wyjedziesz."
Dialogue.Hacker_01_CommandSentYouStasiAreComing,DOWÓDZTWO Cię przysłało? Musisz mi pomóc. Nadchodzą STASI.
Dialogue.Hacker_02_WhatAreWeGoingToDo,Co zrobimy?!